{"$schema":"https://json-schema.org/draft/2020-12/schema","$id":"https://github.com/rogerchappel/agent-handoff-contract-skill/blob/main/docs/handoff.schema.json","title":"Agent Handoff Contract","type":"object","additionalProperties":false,"properties":{"title":{"type":"string"},"objective":{"type":"string"},"owner":{"type":"string"},"currentState":{"type":"string"},"inputs":{"type":"string"},"expectedOutputs":{"type":"string"},"approvalBoundaries":{"type":"string"},"sideEffectLimits":{"type":"string"},"verification":{"type":"string"},"blockers":{"type":"string"},"nextAction":{"type":"string"}},"required":["objective","owner","currentState","inputs","expectedOutputs","approvalBoundaries","sideEffectLimits","verification","blockers","nextAction"]}
